post_id,post_text,post_description
1hss60e,Husband poured cold water on me while I slept,"Feeling overwhelmed and looking for advice… 

Background: 
My (32 F) husband (42 M) and I have a 7-month old baby. I exclusively nurse (we did triple feeds the first month because he was born very small and had low blood sugars and then switched to exclusively nursing because the bottles, pumping, etc were all too much for us, baby was spitting up / vomiting / etc) so we are currently only nursing (with some solids introduced during the day for texture / taste). We tried to reintroduce bottles around month 3 or 4 and baby refused. We’ve tried straw cup drinking around months 4 or 5 which might’ve been too early. It’s on my to do list to try again with straw drinking. We had some challenges at first with solids (he broke out in full blown hives with the first 3 foods he tried which spanned over about a month to allow breaks to recover between foods). 

I’ve also had various health conditions pop up since he was born (so on going about 7 months now) that I’ve been struggling to manage. We had ants a few months ago and I thought I had ant bites all over my feet and legs. The “ant bites” ended up spreading and ongoing for months and I eventually learned that they are rashes, not ant bites. My hands started to break down in rashes too which I thought was a manifestation of my celiac (gluten intolerance) so I thought it would go away because I haven’t been consuming gluten and assumed I must have accidentally consumed some that triggered a reaction. When the rashes persisted, I scheduled with a dermatologist and she prescribed some creams including a steroid and antibiotic which have been difficult to balance because I need my hands to take care of baby. I ordered cotton and non-latex gloves to put over the creams but even getting the time to go through the cream routine, brushing my teeth, etc etc has been tough because baby is so mom-dependent right now and cries a lot with dad despite efforts for them to bond. At months 3 or 4, baby would take to dad for maybe 5-15 minutes total per day (24 hours). We don’t have any other family support and I’m staying home full time currently to care for baby.

Our current routine is that baby wakes up at 6:15 am, nurses until about 6:45 am, hangs out with his dad until 7:45 am, and then dad gets ready and goes to work at 8 am, returns at 4 pm. I usually sleep during that 45 minutes because after caring for baby all night (we also co-sleep and co-nap, please don’t criticize) it is the only time I get to stretch out in bed and sleep as a solo person and can sleep on my belly or however I choose. It is my only “me” time, and I choose to sleep after late nights with baby eating every few hours because I am completely exhausted and need the energy to take care of a baby solo for the next 8+ hours. 

Fast forward to today, I was dead exhausted this morning, and instead of letting me sleep, my husband kept insisting I wake up and poured cold water all over my face while I was asleep.

It turned into a fight. We hired someone this week (as a trial week) to help us meal prep because I’ve been struggling to prepare healthy meals for myself while also caring for a 7-month old. We were still arguing when she was supposed to arrive so I suggested we ask her not to come today and we’d still pay for the day and groceries of course. He got mad saying the world doesn’t start and stop for my feelings which is true but we can’t have a stranger in our own while we’re arguing and I was still shaken up by the morning (husband smacking me and pouring cold water on my face to try to wake me up). When I mentioned cancelling today, he said, “No, she is fired if you cancel her today! You can starve!” 

He says I was “faking being asleep” and I kept asking him not to speak on my intentions and I wasn’t fake sleeping, I was actually sleeping. Although “sleeping” is an oversimplification. In reality, I was half asleep, half awake, half paralyzed by what was going on around me and too exhausted to even use my words, half utterly defeated by the complete lack of emotional support I’ve been desperately needing. 

I know this post is all over the place, we are just struggling, and I don’t know who to turn to for emotional support. I have been asking my husband for months for emotional support and am faced with invalidation and dismissiveness and I’m exhausted and don’t know what to do. 

Any advice would be appreciated. "
l7g3e7,Does my bf have the right to be mad that I left our hotel room last night to eat dinner,"Me and my bf are currently on vacation and drove almost 25 hours without eating anything mostly because he didn't want to stop.

We got to our hotel room at around 10:30 pm and I was absolutely starving and asked if he wanted to grab dinner at the Cafe across the street and he said no. I tried to go to sleep but couldn't because of how hungry I was. I ended up going to the Cafe while my bf was asleep and got myself a burger and fries.

I get back to our room to see him waiting for me and started yelling at me for leaving. He complained that I only had to wait 8 hours more for the breakfast bar to open.

My stomach was actually hurting from not eating anything and there was no way I could wait that long. Does he have the right to be angry at me?"
1h9mp4i,"18M, my GF (F) told me she was 22, but now she says she's 29 and about to turn 30. What should I do","I’m an 18-year-old college student, and I’ve been in a relationship for about 6 months. When we first started dating, my girlfriend told me she was 22. A few days ago, she revealed that she’s actually 29 and will turn 30 soon. This revelation has left me feeling confused and unsure about what to do.

I love her, but the age gap feels overwhelming now, especially since I was under a different impression about her age this whole time. As a college student with no income, I was thinking I had some time to build myself up before considering long-term commitments like marriage or starting a family. But now I feel like the pressure is on, and I don’t know how to handle it."
w6kxth,Don’t know when parents are coming home,"15F here. So a little over 3 weeks ago my parents told my brother (9M) and I that they were going out for a while to see some friends and May end up spending the night somewhere. Didn’t really think much of it at the time and but they haven’t been home since and I’m not sure what to do.

They’re not missing. I’ve texted both of them multiple times now and they always respond, and I’ve even FaceTimed my mom several times and it’s definitely her and she seems totally okay. But when I ask them where they are or when they think they’ll be coming home they just sort of avoid the question. 

I’m starting to get really worried, especially since they now saying I should use their credit card they left here to like, buy groceries if I need to, which I’m taking to mean they’re not coming back for at least another week.

I have no idea what to do. Do I call the police? Again they’re not missing, they just won’t come back home for some reason. But my brother is starting to get worried now too. If anyone has any advice please do share it because I’ve never been this confused in my life

UPDATE - I posted this update earlier as it’s own post, but it was removed as updates are supposed to be added to the original text unless they are asking for additional advice, which mine was not. Here’s the original update however:

Hey everyone. I just wanted to make this post so that you all know what’s going on now and that we’re okay.

My grandparents are here at the house with us now. They called back as soon as they got the voicemails I left and immediately started heading this way. I feel a lot better now that they are here. They called the police once they got here. They talked to them, I talked to them. All that we really did is tell them everything I said in the original post I made and showed them my texts with them. We don’t have much more information then that.

My grandpa called our dad and I think he actually spoke to one of the police officers. I don’t know what he said though, other than he still won’t tell anybody where they are. So we still have no idea what they’re doing or why they left. I promise I’ll make another update when I know more. Please have patience though. I’m trying to cooperate with an investigation now. They’re bringing the police dogs over to sniff around the house and I’m so nervous and I don’t even know why.

This post is really just to let everyone know that our grandparents are here now and we are fine and alright. And I just want to thank everybody for helping out and being so supportive. And was really freaking out last night and I appreciate all the kind words. I’ll update when I can"
14i79q2,Stupid but I have a problem with a seagull at work,"I’m a line cook. I go smoke by the dumpsters a few times a day. We get seagulls in our parking lot- it’s a well known restaurant, it’s busy, and tourists are sloppy with their fries. I also suspect the tourists are feeding the seagulls bc it’s “cute” even though it’s very against the rules. Regardless, the gulls do not fear man or god. They are used to people.

A few weeks back, one of the gulls swooped down and took my cig. I think he thought it was a French fry. I giggled, and went about my day. However, it’s happened a few times since. I know it’s the same guy because he has a dark spot on his chest. I call him The Pestilence. 

I’m concerned he is now addicted to nicotine. He’s by the dumpsters at the same time as my breaks, every single day. This is obviously not good for him, and I’m getting mad about him bumming off me because smoking is expensive. Do I try to quit smoking? I’ll make noise and try to appear large to scare him off, but The Pestilence is hip to my tricks. Have work crack down on tourists feeding the gulls? What do I do? Are there sonar weapons, such as a dog whistle type of thing, that I could employ? 

Sorry this is fucking stupid. I’m being bullied by a seagull. He also stole a $10 bill from my coworker. It’s very rural, so we don’t have animal rescues and animal control just laughed when we called. Any advice welcome, and yes, I am serious. He sucks but I care about wildlife and he’s probably too young to be smoking

Update: dying that this blew up. The Pestilence was off today due to rain, but I am going to get photos and/or videos of our gulls for y’all- I’m off a freakish amount next week, but I will try when I am in. thank y’all for the advice, and for the laughs - I’ve been a bit down lately and it’s much appreciated. Thanks for the awards, but please donate to rural animal rescues instead- we clearly need it, their DARE programs obviously sucks. And do also donate to a women’s shelter if you assumed I’m a man- I’m just a mess of a woman, it’s easy to get those confused. And also, yes, I am a writer, and am about to try to publish a chapbook (that’s a different advice post I still gotta make tho). Once again, thank y’all - I will tell The Pestilence he has fans, but, again, he’s a terrible listener and can’t understand my accent. Have a great night, and pray for me even though we all know God is laughing at my misfortune."
tk7jvz,"My 28f, sister 35f, is demanding I either abort or let her adopt my baby.","I, 28f, am currently 19 weeks pregnant. My partner, 29M, and I are very excited, as this is our first baby and we have been trying for a few months.

We announced the pregnancy a month ago at a dinner party we hosted, and everyone seemed surprised and overjoyed. My sister, 35f, who I will call K, immediately burst into tears and asked me how I could do this to her. I stared at her, and asked “What?” She started ranting, saying that I always got everything I wanted (which is not true, I worked hard for all that I have) and that she knew I got pregnant just so I could rub her infertility in her face.

She screamed at me for 5 minutes about how I didn’t deserve to be a mother and she should be the one pregnant right now. My parents left with her soon after, and the party was basically over. I was really disturbed by my sister's reaction, because we had been pretty close before, and she had never done anything like this.

K called me the next day, apologizing for how she acted at my announcement and asked if we could meet up for coffee. I accepted. We met up and she pretended as nothing had happened. Then she started a big speech about her infertility, how heartbreaking it is to be growing life inside of her, just to lose it, and how she had always wanted children of her own. She then proceeded to ask me if I could consider getting an abortion, to make things “fair”, or letting her adopt my baby. I stared at her and asked if she was serious. K said she was. I just dropped my part of the bill on the table and left.

L texted me a rant that night about how I’d made K cry, and how all they wanted was to be parents, and that this meant so much to them, and I “owed” them for being more successful than them. I and my partner invested many years into our jobs, and we have worked very hard to earn what we earn now. I told them that my partner and I had been hoping for kids too and that I was not giving up my baby. He hung up.

She later sent me a long letter (4 pages) about how she had always wanted to be a mother, and could I consider either abortion or letting her adopt my baby, how I should care about my older sister's happiness, how she would make a better mum, how the oldest kid should have the first grandchild, and how I could always just have another baby since it was ""so easy for me to conceive"".

After that, she quieted down some, and I thought we were done with this. Except... it wasn't. She had posted MY SONOGRAM on her FB, and captioned it “L and I are expecting! We can’t wait to meet our little princess!”

I was seeing red. I texted her and demanded she takes the post down. No reply.\`\` I texted L. No reply. So I called my mother and told her what happened. She was able to make K take the post down, luckily enough. K has called me petty for calling my mum and has continued to demand I give up my baby. I sent her a letter explaining that I had had enough of her nonsense, I AM keeping my baby, and that I recommend she get some help. I added that if she continues, I will not hesitate to call 999.

This weekend, however, was the absolute last straw. My mum and dad have the spare key to my house, and while she was over at their house for brunch, she took the key. While my partner and I were at work, she broke into our house and stole all the clothing, blankets, nappies, bottles, and pretty much any other item we had bought for the baby, except furniture. It was later returned after my mum found it in her car. I called 999, but they told me I couldn't do anything because I had no proof and because it was all returned.

My partner and I are moving in April, but I'm still scared my sister will find out where we live and take my child. I get that she's upset and jealous, due to her infertility, but that shouldn't mean I have to give up my baby. My parents know about this, and they have been doing their best to get her some help. She doesn't want to adopt, because she wants a child that's her own flesh and blood. I'm due in August, and the stress she's causing cannot and will not be good for me or the baby. My partner is looking into a cease-and-desist letter. Is there anything else I should do or say? I'm scared for my baby.

**UPDATE 28-3-22**

The support I've received from this website is overwhelming! Thank you all for your comments, although I couldn't reply to all of them, they are appreciated! We have had the locks changed, cameras installed, and a Ring doorbell. I've started saving every letter and screenshotting every message my sister has sent and plan to take them to court for a restraining order very soon. We have also been seriously documenting everything.

My husband and I are planning a trip to Ireland for our anniversary next week, and it's going to be good to clear our heads from my sister. I've called 999 to report her for harassment, and they gave her a warning. She's contacted me saying that if I won't give her my child, I can at least pay for multiple rounds of IVF, which I have not replied to other than refusing. She's been begging my parents to convince me to give up my baby, which they refuse to do. They have also been given a statement that basically says that if they give her my contact information, they will not see my baby, to which they have agreed.

I've since changed my phone number, and we are moving very soon. My sister does not know our new address. She actually stood on our stoop for 20 minutes a few days ago, banging on our door, and yelling. My husband opened a window and told her that if she didn't leave, he would let the dog out, and threatened to call the police. We have a rather small, but hyper puppy who jumps on everyone and barks a lot, and she is quite scared of dogs, actually, so this made her leave. I started working from home last week, as did my husband, and we've followed the advice of one of the comments, washed all of the baby stuff, as well as made sure none of the food in our kitchen was messed with (none was, luckily).

We're planning on getting a restraining order as soon as possible, and are looking forward to our trip! I'm already sick of being pregnant, and I'm not even in the third trimester. I just want my baby. Thank you all again for your wonderful advice, and I may update you again when the baby is born."
iwa83b,I think my girlfriend has been trying to get my fired from all my jobs. I'm shaken. Please help me.,"
https://www.reddit.com/user/GettingMeFired/comments/j9awz1/update_on_the_post/?utm_medium=android_app&utm_source=share

I'm M24, and I've been with GF (F29), let's call her Janice, for 2 and a half years. I just finished my education when we started dating and I have been doing all sorts of jobs since. Sometimes two at a time. I did this to expand my resume and gather job experience.

I worked in cafés, bookstores, a library, a grocery store and as an English tutor. Most of those jobs lasted about 3 to 5 months. My shortest stay was 2 and a half weeks, my longest 8 months, but since I didn't have a hard time applying for new positions, I tried to block it out, though it was kind of eating me up internally.

People called to complain about me, people left bad reviews about me, people used my employee wifi access to look up sketchy things on the internet under my name, former 'employees' called to 'inform' them about me, right name and all, and much much more subtle stuff that I couldn't disprove. But I was too anxious to do anything about it. I just told my girlfriend, she comforted me, she supported me every time I got my life ruined by these people. But I kept going, though they kept finding me.

Fast forward to this week. I currently hold a part-time position at a bakery, I've been working there for two months and a half. It's going okay, but my manager approached me about something regarding our google reviews.

Someone was complaining about an employee, and their description of them could only really fit me. It was on a day where we're pretty short of staff, so I could've been the only person in the store on that day for all I know. Anyway, their review contained some pretty elaborate and nasty comments about me. This has happened on one or two of my jobs already.

I told my manager that it was all pretty bogus and that someone had a vendetta against me, as it has happened before. She believed me, and told me that she'll dismiss the comment. On my break, I checked out the review myself. Their username was kinda stupid, I'm not gonna type it out here since I still work there, but I'll just call them ""Mick Myrtle"" as it was in the same range of sounds-kinda-fake-but-not-really. Anyway, I come home but don't tell Janice about it. She has heard it all before, so I didn't see the point in complaining about another time I almost lost my position.

We chat, all is well, and she leaves the room. Her phone is on the table, and suddenly, she get's a notification or an email of some sort from google. I don't remember what it said exactly, but the popup read something along the lines of ""Mick Myrtle: 'Manager' has responded to your Review!""

My heart dropped. I've been trying to ignore it since. this was two days ago. It just fit in the picture of bad reviews. It fit in the picture of the phoned complains my workplaces have received about me in the past. It fits in the picture of all the sketchy things I've been fired for.

Why would she do that, though? I'm looking for an explanation. This literally can't be. She's the only thing keeping me sane. I don't know what to do."
toq8ob,"My husband is obsessed with Destiny’s Child, and it’s ruining our marriage.","Last year, my husband discovered Destiny’s Child. I don’t know how he wasn’t aware of them before, but that’s beside the point. He obviously didn’t have this obsession before we were married. In fact, we have been married for 7 years, and he’d never exhibited any signs of obsessive behavior before this. Now, his obsession is taking over both of our lives and costing us a lot of money.
He spends all day on eBay bidding on Destiny’s Child merch. He is always the highest bidder, so it’s very expensive. He is only subscribed to streaming services so he can listen to them. He bought a Bluetooth shower speaker so he can listen to them while he bathes.
We cannot have one conversation without him saying something like, “You know, this actually reminds me of a Destiny’s Child lyric.”
He’s spent hours watching YouTube tutorials, learning the choreography from every video. He makes me sit down and watch him dance in front of the TV to make sure his form and timing are perfect.
He emails the members often, begging them for a reunion tour. He has also sent them birthday gifts in the mail. I would like to point out that his obsession is not sexual in any way— he just thinks they’re really cool. 
I’m almost to my wit’s end. I feel like I can’t escape Destiny’s Child and have lost my husband completely to this obsession.
Any advice would be greatly appreciated.

Update: My husband had an MRI yesterday. He reluctantly agreed to it, because he knew I was absolutely terrified and anxious. No tumor, thank goodness. Everything was normal. He is finally beginning to understand how seriously I take this and how much of a problem it’s become in our marriage. He has agreed to visit a therapist. Hoping for the best! Thank you all for your wonderful advice, it means the world."
a1kh25,I’m about to tell my boss I stole almost $5000 from my company,"No one even has a clue the money is missing but I just can’t hide it anymore.... I just posted this to vent and maybe help with my anxiety

I stole it and fed my gambling addiction... 

I am ready for any consequences that come my way though I know o have to man up to it but it’s just stressful and hard. I don’t even know how to start the conversation.

***update*** 

I’m literally waiting outside my bosses office to finally deal with this. I understand  what everyone is saying and I appreciate the support but I gotta do what in my heart feels like the right thing for someone who has taken care of me this whole time...

I will let you all know what happens after

Thanks again all....

***third update***

 I am not in jail yet and I am waiting to hear if I am being charged.

I know everyone was saying not to do it, get a lawyer and everything but honestly I am a good person who just made a bad decision. I could have kept on hiding it but eventually it would have caught up to me. Living everyday with that dirty secret not knowing if and when you will caught honestly was eating me alive in my mind. 

It was just a matter of time before I would have been found out.

For the last couple of months I was gambling every penny I had just to win it back... 

I went to seek help today and I will continue with trying to fix myself so I don’t make the same mistake again. 

The losing after the gambling is what made me wanna die. And it was a feeling in the moment, if any of you can understand that.

I will update as everything in this situation unfolds.

If you private message me or try to chat there are like a hundred so I am sorry if I don’t respond it’s just a bit overwhelming.

***Fourth update***

My life has been such a rollercoaster these past couple weeks. So much has gone on... just wanna tell you all I’m not in jail...things are so tough right now for me so I have just been too depressed to even post. Thanks for all your support sorry to leave you hanging. There’s so much more to this and I am just trying to keep my head up..."
