post_id,post_text,post_description
slr1f6,Found CP on my father's computer.,"Me (19M) and my dad (52M) live together in a condo. My mom (53F) and him are separated, if that matters.

For context, here is how our living room in the condo is set up: both my dad's and my PC setups are in the living room, facing toward opposing walls.

Anyway, I come home to the condo after a doctor's appointment. I go and sit down at my desk as usual. My dad and I are conversing about my appointment, just usual casual talk. While we're talking, he looks away casually to look at the kitchen (away from the living room), and I look away at the same time at his computer screen. He already has a bad habit of keeping applications open on his computer, even when he is away or asleep.

At a glance, I see pornography. I personally don't think much of it, because it isn't a crime to have porn. The man is single, so hey, everyone needs to get off sometimes. However, it did look strange. It was a paused video on an MP4 player, in a small window on his computer. He has other windows open too, but it's just normal casual Youtube stuff.

I don't think he noticed that I saw what was on his screen. In fact, I don't even think he knew it was on his screen. He probably thought he closed it earlier or something.

He says he's going to get ready to play pool, so he goes to his room and the bathroom. While he's away,  I take a closer look at what's on his screen, and sure enough... it's of a little boy. Like no debate, it is of an underage child.

I wanted to throw up and cry, I didn't think he would do anything like this. If there's one file, there's more on his hard drive for sure, right?

I needed to play it off that I never noticed, once he comes back and tells me he's leaving to go play pool. So I hop on a game on my own computer to make it seem like I was too distracted by my own gaming to even notice what's on his computer screen across the room behind me. About 20 minutes later, he comes out, turns off his computer, and says he's leaving, all while I'm playing the game. It seems that it worked.

I told my mother about what happened. I'm staying at my mom's place now. She seems to have the perspective about how to keep the family together, but I personally think this is already past a family matter. This isn't a victimless crime. I don't even know how long this has been going on. He's always been a good father to me, but I feel so disgusted. Has he ever looked at me the same way he looks at those little boys? How does he even acquire this stuff?

What should I do? Should I file an anonymous claim? Should I confront him? Tell him to seek help?

&#x200B;

EDIT:

My girlfriend (19F) comes over on the weekends sometimes, and she prefers staying at my dad's condo than my mom's house, as there's more to do. I haven't told her anything about what I discovered about my father. I don't feel comfortable bringing her to the condo, especially if she's sleeping over. What should I tell her, if anything?

Also, my dad's own father has a history of pedophilia as well. My dad grew up to hate and despise him, as he abused and molested his own children. I feel that my dad, who knows well how child abuse and pedophilia can ruin a family, should know so much better than to do this."
p47jzn,I want an abortion. My boyfriend already told his parents about future grandchild.,"Hello. So myself (27F) and my boyfriend (27m) have been together for about 7 years and accidentally got pregnant roughly 4 weeks ago. I’m on the pill and we use condoms so I’m really surprised this happened.

I’ve been very open with everyone in my and my bfs family’s that I DO NOT want children. I have an autoimmune disorder that makes it very likely I’ll experience some kind of complications and possibly die during pregnancy. I also don’t have strong maternal instincts and hate being around small children.

I told my bf that somehow I was pregnant and I would be going to the doctor as soon as possible to schedule an abortion. (They are legal in my country before 20-30 weeks) 
But when I got back home today my bfs parents were there and both of them hugged me and congratulated me on “finally getting pregnant.” And were so excited to be grandparents. I had to tell them “I’m sorry, but it’s not safe for me to keep a baby. I don’t want children and we aren’t in a financial place to have one.”
My bfs mom started crying and there was a lot of yelling back and forth about it.

I finally said “it’s my body so I have the final say. I will not put my life or my future at risk just so you can have grandchildren.” I than got into my car and drove to my parents house where I have been for the past few days.

My bf keeps calling me trying to convince me to keep the baby and his parents keep texting me begging me to not “kill their grand baby”. I’m so furious he told them and now they are pressuring me and making me feel terrible about my decision.

My parents said they would support me no matter what choice I end up making. 

I’m sure someone out there has had a similar problem. So please tell me, how did you handle it? Did your relationship survive?

Should I risk my life to possibly have the only child I will ever have?
Should I have an abortion to make sure I stay safe?"
w63g2u,I caught my cousin and brother making out…what do I do?,"I walked in on my cousin and my brother making out. I‘m 14, my brother is 15 and my cousin is 16 (all male). We’ve been close since childhood, always running around together and playing video games, yk, what kids do. In the past year I’ve noticed them getting closer, but ofc just thought they were bonding so I didn’t really suspect anything. Two days ago we all met at our yearly family gathering, it was really fun and I got to see a lot of people that I missed. My brother, my cousin and I decided that we want to stay at my grandparents house for a few more days so that we can hang out because we don’t see each other that much anymore. Yesterday, i went out for a little to get food from the store across the street. It took me a bit longer because we eat a LOT of snacks and it was like shopping for a family of 5. When I came back after around an hour or so I noticed it was quiet, which is very weird for us since we’re all very loud. I walked upstairs to the bedroom we shared to figure out why and when I opened the door my brother was on top on my cousin and they were making out. Like heavily making out. My brother wasn’t wearing a shirt and his hands were all over my cousin. I just kinda froze and they jumped apart. My cousin started crying and my brother instantly comforted him, he himself also tearing up. I awkwardly stood before walking out. I just kinda sat on the porch for a bit, processing what just happened. My brother came out of the house and we awkwardly sat in silence for a while before he spoke up. He said “I know it’s weird but me and [name] really love each other. I’m sorry you found out this way.” And walked off. It’s been really awkward and I don’t know what to do. I don’t really know how I feel about it either. I, for one, didn’t know either of them were gay. I’m in no way homophobic, my girlfriend is bi and I have a lot of gay friends who I support fully, although I am straight (I think). But secondly, we are literally related. Our dads are brothers, and I see both of them as brothers. I mean they’re happy, but yet again oh my god. Im definitely not going to tell anyone in our family, I don’t want to ruin their relationship even if it’s a bit weird. But I also don’t know, I feel like our relationship isn’t going to be the same, and I kinda don’t want to be that close to them anymore, which makes me feel bad. What should I do?

EDIT: I talked to them earlier and we had a long discussion about it. I told them that I do support them being gay, but I’m not sure about their relationship. They said they understood and I asked for a bit of space. I also promised them that I won’t tell an adult, or anyone I know irl for that matter. I asked how long they had been a thing and they said 11 months, so it’s been going on a for a bit. I told them I was happy that they found love but am slightly weirded out. Im currently not talking to either for them for at least a few days and just taking my time to think, Ty for the advice!

Also, for all the people assuming I’m in the US and stuff, I’m German, live there and all this is happening in Germany. Please stop making Alabama jokes, it’s annoying :)"
p3sibk,"Wife has given hall pass, no idea how to use it…","I’ve been happily married to my wife for 10+ years, we have 2 awesome kids together, and we are an awesome team.  We’ve had some ups and downs but things are going perfect.  We definitely want to grow old together and raise our kids together.

She’s recently gone on some meds to help with her mental health, which has driven her sex drive to almost non-existence.  The little sex drive she does have she prefers to control herself.  She assures me there is nothing I can do to improve her experience in the bedroom.  and she has candidly told me she would support (and even pay if necessary) me to seek physical intimacy elsewhere.  

I don’t want to demand sexy time from her, and I don’t want her to feel guilty about not wanting to satisfy my needs.

So here we are, I have a hall pass (that I would prefer not to use) and I have no idea how to use that hall pass.  And by contrast I think my mental health will degrade without physical intimacy.

I legit have no idea where to go from here.  My apologies if this post is not appropriate for this sub, if someone can message me a more appropriate sub I can take this down right away."
wqsrof,I don't know if I can ever talk to my brother again,My fiance (21F) was super stoned and drunk and slept downstairs and my brother (18M) and he fucked her. I don't believe that she was able to consent because of her imparedness. Am I right is it his fault? My family says it wasn't his fault and i should forgive him.
xtr27j,"My 13 year old wants to have sex, help!","She told my wife and I that she’s ready to have sex and wants us to get her pills and protection. She said she’s doing it whether we want her to, so she just hopes we’ll give the the resources to be safe. I am on the fence because she’s too young for sex. My wife thinks we should do it so she doesn’t get pregnant. I don’t want to send a message that sex is ok, but I also don’t want her with an STD or pregnant"
wpj4yg,(30) My friends say my wife (55) groomed me,"Back when I was 18, I didn't have enough money to go to college. I also failed to get scholarships, since I was mostly average. I thought about taking out loans but an older guy in my neighbourhood told me how he still couldn't pay off his loans after five years. Enter Penny, who was 43 at the time.

She's the daughter of the company where my dad worked as a janitor. She's seen me around before since I was a young boy and asked me why I was looking so glum. I told her what was on my mind and she said she'd pay me for sex. I said yes. Somehow it ended up turning into a real relationship after I graduated. She no longer paid me for sex since I became her boyfriend. Few years after I graduated and got a job, we married.

When my wife told my friends how we met, they all accuse her of having groomed me. How do I get them to stop? Or is it impossible to stop them? Is cutting them off the only choice I've got?"
ot4enx,What should I do about my super loud neighbor that scream masturbates at 2am?,"Didn’t know where else to put this weird one so it’s here ig lol. So for the past 3 days straight my upstairs neighbor (I live in apartments) has been masturbating crazy loud for about an hour, sometimes more which is oddly impressive, at 2 in the morning. I can hear so clearly I can tell it’s just her, before someone asks. I’m obviously trying to sleep. It feels rude to like, bang on the roof or something. She has as much a right to do her business as anybody but I’m getting frustrated. I have never heard anybody scream and moan this loud. I need some quiet so I can sleep but I don’t know what I can do. I don’t like the idea of sleeping with earplugs or being rude and I am not going up there.  Anybody have suggestions? Thanks!"
mvtrzg,"Living with girlfriend, got promotion (50% raise) to work at the Bay Area. Girlfriend says to look somewhere closer instead since she can't quit her job (she will only do so if I marry her). Should I stay or go?","Basically as the title read...

I really like this girl, I enjoy my time with her.  We have been together for 2 years.  But I am 30 and I don't see myself marrying right now or even having the mentality to look after a child at this moment.  She often brings up the whole ""my time is ticking"" and wants to marry to have a family.  I have always been honest  with her and have told her that I don't know when ill be ready.  She has been hoping I would change and its been 2 years now.  

Now I just got an offer that would put me in the Bay Area and give me substantial increase.  We live about 6 hours away from the location (not too bad?) and in California.  I want to accept the offer, but I know that would mean that she will want to come and would want me to marry her.  I totally understand her reasons.  She has a high paying job, bought a place, and has established herself in the area (her name is known).  I do see that she is coming from a sense of ""security"".  SO I do feel bad for her to drop all that to come with me.  But that is what she is willing to do if I marry her. 

I have also talked to her about just being long distance for a year (each visit one another at least once a month) and I could apply at jobs in SoCal after a year. But she doesn't want that and has told me that it would probably be over if I do that. 

To me this is a Golden Ticket that would put me out there to a bigger network and would also push me further into my career.  But I just don't know what to do.  I can take the Job and marry her, take the job and NOT marry her (and see what happens), or just not take the job.  Any advice?"
rnbygo,my girlfriend has been sending nudes to a guy without me knowing,"I really need help from everybody in this subreddit, we have been dating for 5 months, and I just found out that my girlfriend had been sending nudes to a guy wtf and she has never told me, I just found out because I was facetiming her and she was with her best friend and her friend brought it up, my girlfriend was talking to her friend and said ""omg you still talk to that guy"", and her friend said ""this guy that you sent nudes to?"" I was like HOLD ON what the fuck.

Long story short, she said the guy was feeling horny and she felt like she was forced to, so he asked her for a video of her touching herself and she sent it. She always tells me that she is a virgin and is very innocent, and a good girl but I did not expect to find out like this. She doesn't even send nudes to me so I was really shocked. 

I don't know if that counts as cheating, she said she was trying to ""help him out"" because they are friends, she said she doesn't talk to him anymore because he saved the video and its very awkward. 

Do you guys think this is forgivable? or should I end things with her? like what if there are other things I don't know.."
1fc74gg,My finance assaulted his bff on his bachelor party ,"I don’t know what to do. My (f28) finance ( m28) Alex has a bff ( Dani 28) since they were 4. She’s not like the usual Reddit bff. She’s a lovely sweet person who has never crossed boundaries with Alex or their two other friends Marcus and Daniel. The four are very close. Dani is gay and always was. She is very much a woman but likes to dress in jeans and t shirts and not in any feminine clothing. She is lean tall has short hair and  is just one of the boys in a lot of ways.  
 
This weekend was Alex Bachelor party. All four plus two other of Alex friends went along. It was to a costal town that’s well know for hosting bachelor and bachelorette parties but there’s no strip club or anything. They stayed in a b&b and have scuba diving and kayaking planned. First night went ok dinner restaurant and night club and home. Last night was the issue. They did the nightclub and headed back to the house. Marcus and Daniel who are both single brought back two girls from the nightclub and got busy in their bedrooms. The rest were drinking in the living room but things got a bit loud and the two friends started complaining that they didn’t get to go to a strip club and never got to see t*ts and ass. They were blaming their wives and calling them names. Dani told them to shush as it was ruining the mood and they both thought it would be funny if they saw Dani’s body naked to make up for it. The thing is Alex joined in and they stripped her. She was screaming loudly and Marcus and Daniel came running and rescued Dani and put her in the a bedroom with the girls and had a fight with the three men. Daniel doesn’t drink due to a chronic medical condition and the medication he is on. So they packed up and took Dani and the two girls and left the other three. Dani was hysterical and Marcus wanted her to go to the police but she wouldn’t. She was afraid to go home so they ended up dropping the girls off and taking Dani to her parents which was an hour away. 

Marcus was at my door at 7am this morning and he told me what happened that if he ever sees Alex again he’s afraid of how things could go. He told me that if he can convince Dani to press charges he will . Then he left . 

Alex returned about 3 this afternoon. He was a ting normally until I told him Marcus has visited. He was very nervous and tried to play down what happened as a joke that got out of hand. I’m devastated. I heard him out but he knew I wasn’t accepting what he was saying. I told him Dani may be going to the police and he got very panicked and pale. He said she had him blocked and he wanted to go talk to her. I told him she wasn’t at her place as she was too afraid he or his “ buddies” would turn up there. I asked him to leave and he didn’t want to go but I insisted. He was crying saying it was a prank that got out of hand.   

I heard him out only as a courtesy to our two year relationship but I’m done. I don’t know this man. I don’t know if I should reach out to Dani or just do nothing. Marcus and I have been in constant contact and he agrees that I have no option but to end things. I don’t know where to start with cancelling everything as the wedding was in 5 weeks but it seems trivial compared to what Dani is going through right now. Marcus is convinced that Dani is going to the police after talking to her parents so I think Alex is in trouble. I can’t support him on this. Maybe I’m wrong as he was drunk and probably had taken other things but this was his friend from age 4 and he did this to her. I’ve not blocked Alex but I’ve not replied or picked up any of his calls. "
tk643z,My dad started to touch me inappropriately,"A week ago he (40m) picked me (15f) up from school and then started to stare at me but at my chest, i told him to focus on the road and he did until he pulled over and put his hand on my thigh and started to go up to my crotch, I got really frightened then he stopped and went back home like nothing happened. I stayed in my room the whole day after that and felt scared whenever i was around him, he later came to me and apologized and said if i ever told anyone it would be my fault if he got in trouble, so i kept shut about it. Then the day after that he did it again but put his hand my t shirt and touched my boobs saying he was giving me a massage, I tried to get away from him and show discomfort but he wouldn’t let go, i was shaking after that. I don’t know what to do because everyone sees him as a good man and wouldn’t believe me"
1kzm0xt,How do I convince my wife to consent to me mowing my parents lawn?,"Wife (40 f) is upset with me (39 m) for planing to mow my parents lawn (74f & 74 M)

My parents 50 years anniversary is June 5.

It will take me 3 hours to drive to parents house, mow lawn, drive back.

Wife and I have been arguing for over 15 hours over the last week about mowing the  lawn for 3 hours.   I'm in too deep.  I'm willing to argue another 30 or 300 hours to mow for 3 hours.

In my wife'a defence she adopted a stray cat and the cat has now left for 5 days.  She wants me home to find the cat 

I did discuss plans to mow parents lawn before cat went missing.  I just want to mow the lawn and be done with it for 6-8 weeks.

Update.  I don't have any more energy to fight about it. I'm bussing instead of driving might take 5 or 6 hours. Hopefully longer.

We have been fighting all morning.  In that time I could have drove mowed and come back.   The endless fight over the lawn is draining time that could be used to find the cat.  

She is trying to call me but I can't hear any audio.  She threw my phone this morning and there is a crack by the volume button.

I'm just depleted and defeated. I need to get away.

Update 2.  Took about 38 minutes to mow lawn including time answering calls to be screamed at.  Catching breath and about to do a little more yard cleaning.

Udate 3. Taking some time. Going to go help parents with one more task.

Earlier in the week I ordered Nightreign for Xbox from best buy.  It gives you a $10 gift card.   I ordered the game from her account (we already have a few gift cards attached to her account) but paid with my card.  Using her account (never a problem in the past) while she is grieving the cat is now going to me more to dump on to the fighting.

Update 4.  Heading home soon to see if she is ready to turn it around. If not I'll stay at my parents or sisters for a while.  I'm nervous about that because I don't think she is any shape to take care of the dog.  Maybe error earlier,parents 49th on the 5th. Hope some of the comments help her see our rediculus this has been.

Update 5.  Might have something to do with her doctors not responding and medications not being renewed.  Tried asking more information about this and what medications are not renewed but she flipped the bird."
14f6u33,I was given an ultimatum,"It is what it sounds like. So basically me (24F) and my boyfriend (27M) have talked about marriage. We have a 19 month old baby together and live together. We have been together for 3 years. 
I am going on a birthday trip with my friends 3 girls, 2 guys. We leave on Thursday. My boyfriend tells me he is going to ask me to not go on the trip. I ask why and he says he has a bad feeling. Now, after he elaborated he was saying our relationship isnt in a good spot for me to be going on vacation…. 

This vacation has been in the works since January. SIX MONTHS. 
So now, he says. Do you want me to tell you what happens if you go and if you dont go. Sure why not. 
He says if you go on this trip I will not marry you. If you do not go on this trip, i was going to propose. He wants to know that I will listen to him and that our relationship is more important. His words. Marriage means a lot to me but I feel like this is a control thing knowing I spent a lot of money and planning to be off work to go. 

Now if this was when I first told him about the trip, he wanted to say this then fine. However, its 2 days before the trip. Idk what to think. What do you guys think?

EDIT: I must add when we talked some more, he said he wants to know I will sacrifice for our relationship. So he purposely waited until the trip was coming up and asked me not to go.

UPDATE: this post has gotten SO much recognition. Im glad thousands of people feel the same way that I do and know I am not tripping and going crazy for the ultimatum he gave me. I did in fact go on the trip. I also did consider not going. This was up until he said even if I don’t go, that we should go our separate ways. I’m heartbroken because we have our lives intertwined. We have a child together. And now, I’m on this trip, miserable but also knowing I would be miserable at home if I stayed. Life is so unfair. Up until this point I have done everything. I’m tired and overwhelmed. I HATE to be a statistic of being a single mom. That was always my worse fear. I can only blame myself though. Thanks everyone for the love and hate comments.

NOV 2023 UPDATE: Just a quick update since someone ran across this post! We are still together and worked through that issue. I never really got to the depth of what he was feeling but my guess is insecurity and wanting a homebody? Idk. However we did work pass it and are still together. "
t9h12t,My high school students want me to teach them Life skills not taught in regular school... what do you think they need to learn before they graduate?,"EDIT: These are wonderful!!! Yes, please keep going, I'm reading and upvoting all the comments, some great stuff in there!"
