post_id,post_text,post_description
1lib2n8,"My parents find my girlfriend unattractive, and now its starting to affect the way i look at her too.","I never once found her unattractive, but now, after hearing it constantly for the last 9/10 days, its starting to seep into my psyche and now Im seeing all the imperfections she has.

I fucking hate this feeling and I hate what theyve done to me.

On the surface its so easy to see that its their opinion and that I can always just.... not think like that. 

but man, that shit just seeps in and comes out in your relationship. 

  
UPDATE: I have decided to move out of my folks place, focus on my relationship, and also go to therapy to get rid of such vile voices circling my head. "
shbrvz,GP criticised my pubic hair then patted me like a child,"I went to a GP about an intimate issue today. I was incredibly nervous and even expressed this to her upon arriving. During the physical examination, the first thing she did was complain about my pubic hair and tell me I should have trimmed it before the appointment. I was under the impression that this is not a medical practitioner's business, something which shouldn't concern them, and certainly something which shouldn't be commented on. Then before I left the office she patted me on the cheek in an overly-familiar, condescending way like a grandmother or great aunt might do to a child.

It didn't feel like a professional encounter at all and I left feeling shamed for my body which I'm already overly self-conscious of, and without my questions being answered so I've now got to either ignore the problem or pluck up the courage to see someone else about it. I'm still hurt. What should I do?"
11jx4dw,I’m starving and my mom won’t feed me. Is there anything I can do?,"I’m 16 years old and I live with my Mom, her ex, and my sister.

2 1/2 - 3 months ago, my mom stopped going grocery shopping, and only on some days would her ex go out and buy ingredients to cook with. Meaning that I go most days with no food at all, with my only form of sustenance being my school lunches. On weekends, I’m shit out of luck. Originally, I thought it has to do with a bad financial situation, until she told me outright that she was simply too lazy.

I tell her that I’m hungry, and she replies to me saying “You’re always hungry.” I’m rapidly losing weight. I’m 5’10-5’11 and I used to be 170 lbs, I’m down to 150 now. I’ve never felt more weak in my entire life, and recently, I’ve started feeling dizzy and lightheaded, some times even short of breath. How get through to my mom?"
do4gbg,"Dear redditors, I come to you in a time of need. My father died today losing the battle to cancer. One of his wishes was that we play the most ironic and messed up music at his funeral (ex: another one bites the dust by queen) can you kind folks help me come up with some songs?",
odpq2c,Had a threesome with my boyfriend and his twin. I think they’re in love and I’m freaked out.,"This is weird, I know. It’s even weirder to post this, but I’m just very confused right now and I feel kinda dumb. 

Me and my boyfriend have been dating for about a year, and I’m usually the type of girl that’s up for anything. Our sex life is amazing, and we have a good communication in general. We go to the same university, we live about 10 mins from each other and in other words, things are good. His twin brother was always in the picture, and I knew they were really close even before we started dating. But I thought that was just normal, honestly it might be maybe I’m just overthinking it. I honestly don’t know. 

Yesterday we were in bed and out of nowhere he asks me what I think about threesomes, and whether I’ be okay to have one with his brother. After a lot of convincing, I agreed. And fine, you can judge all you want, but I just thought I’d try it, and the way he described it made it seem less crazy than it sounds as I’m writing it now. 

Anyways long story short, the actual threesome was okay at first. I was uncomfortable but my boyfriend initiated and it was fine. Not to get into too much detail, but there were a few red flags that kept coming up which I can’t stop thinking about. For starters, they kissed each other, a lot, among other things I can’t really get into here. But it was just off. 

Now I know how this sounds, I know I shouldn’t have agreed from the start, but I did. And as a result, I can’t look at him the same way. It feels like he was trying to tell me he’s in love with his brother or something. It’s just really confusing and I have no idea how to open the subject up. Like is it even my place? 

Sorry in advance for this weird ass freaking post, but I needed to share."
t7jchk,My village thinks I'm a reincarnation of a goddess.,"This sounds so fucking crazy. But basically my little tiny village from india (my dad's village we live in the city now) rarely has female kids. They either have passed away as new borns or ran away at a young age. Everyone believes that this because the place is cursed. I'm the only girl who crossed the age of 10 and still visits(I'm 22 now) the place is riddled with tradition and customs that make me uncomfortable. 

Example-Putting money in my shirt and then touch me and saying that they are praying. 

They think I'm a reincarnation of a goddess here to save the village. I fucking hate the place I would rather kms than go back. But, I don't wanna hurt my dads feelings. How do I explain this to him without seeming like I'm ungrateful or here to 'curse' the village again?

The village consist of about 35 people."
1iuyniw,My colleague said something so fu***d up and I dont know what to do.,"Some context, I am 26 years old and I work as a Sofware Developer at this company for 4 years. I have a team lead who is also the owner of the company with whom I have worked with since I started. He is a normal guy, 37 years old with wife and two little kids. We talk and work together every day at the office. Today he said something so fucked up and I just avoided him the whole day and I dont know how I will go back to work on Monday.

We were having a smoke outside of the building at lunch break and he said out of nowhere - 
“I wanna slice my wife in pieces and eat her, and after I am done with her I wanna rape both of the kids before I kill them, I have a demon inside me.”, that sentence came out of nowhere. We were talking about something non-related to work, he said that out of fucking nowhere and went back to the previous conversation like nothing happened. He never said anything like that before, not even close, nothing as fucked up as this, in fact I never even heard him joke before. It was like something else possessed him and made him say that. I dont know what to do. Do I report him to the police? Do I call his wife? Do I quit? Im at loss for words. 


UPDATE: https://www.reddit.com/r/Advice/s/9rCZ2BaqZC"
gfxilc,Parents refuse to teach me how to drive and how to cook. I tried (1st time) making something on the stove and they hit me and cussed me out saying I'm never allowed to use it. Who is in the wrong? HOMESCHOOLED so i dont learn this stuff at school,"Im 17. Not allowed a job either as i (125lbs, 5'7) am anemic and almost got hit walking on the hwy the only roads near us (southern town no public transport for 45+ miles) no sidewalks or bike lanes (not even allowed bike and hell i would NOT even bike in the hwy as im not allowed a phone and would just die there if i got hit as i cant phone for help or go to hospital) town is 8 miles from us i mentioned im anemic because i cannot walk 16 miles a day (8 miles to get a job, work 9 hours and walk 8 miles back). 

So they also refuse to teach me how to cook the only things im allowed to eat are tv dinners and tinned food(not money issue they make food for themselves but tell me i can only have tv dinners/ tinned food) but i tried making eggs and toast on the stove my dad came out cussing and hit my wrist and called me a stupid fucking pos. Like idk how normal this is (im not even allowed to use computer but im
Sneaking on to write this)"
1kzsuq8,How do I get out of going to a strip club?,"I’m (28m) in Vegas for my friends bachelors party and they are planning to go to a strip club tomorrow night. My wife has asked that I don’t go and frankly I really have no desire to go either but the peer pressure is hard. 

I told them I don’t want to go and the guys have given me a hard time collectively saying that they promise they won’t tell or that I can just sit around in the club while they get lap dances. 

I think I’m going to just hang back when they all go tomorrow night but I want to do it in a way that doesn’t make me the center of attention. Any advice to help me figure this out would be helpful, thank you! "
153y0qm,"Ex-fiancée wants to catch up after he left me at the altar, how do I proceed?","Well exactly what the title states, also I’m writing this on mobile sorry for any formatting issues. 

My (28f) ex-fiancée “Derek” (32m) disappeared the morning of our wedding 2 years ago, evading all attempts to reach him from myself and his family. It was devastating, absolutely soul crushing, the event turned into a party to distract from the pain of the unknown, afterwards I returned to our apartment and slept on the bathroom floor in my wedding dress. It was quite the ugly sight to be honest. His mother ended up coming to the apartment when she informed me tearfully that Derek had run off with an ex of his, they had apparently reconnected a week prior to wedding and he just couldn’t go through with it opting instead to rekindle his relationship with his ex. His family was horrified, I didn’t hear from him until 3 months after he left. He called me, apologised and then revealed that his ex had been hiding his child from him that he just found out about, he wanted to be with them. That’s pretty much all that was said, I didn’t say much, actually I think I only said “hello”. The whole situation left me numb, I just didn’t care anymore. Thankfully though my friends were and continue to be there for me, through all of this muck, they encouraged me to seek therapy and work on healing. Which I’ll be honest was terribly difficult, but after year I felt myself again.

Which brings me to today, after the this whole debacle and subsequent self improvement/rebuilding I moved to the UK (originally from Australia) for a change in scenery. Last night I got a message request on instagram, it was Derek. “Hey 👋🏻, I’ve heard you moved to Wales, that’s so cool, I’m travelling to Cardiff towards of the end of July. I’m deeply sorry about everything and I want to discuss what happened leading up to the wedding. I hope Im not overwhelming you, let me know if you’d like to talk over lunch.” Firstly, no idea who told him about my move. Secondly, I don’t know if I crave closure from him, but I also don’t won’t to decide to decline to only layer on regret my decision. 

So I turn to you strangers of the internet, what should I think about before reaching a decision? Would be wise to decline or should I humour him and listen to his “reasons”?

Okay minor update: Wow, this garnered far more attention than I anticipated, so bare with as I try to navigate all of your advice. Although the general consensus is quite clear. I have learned that an old mutual friend of ours revealed where I moved, and evidently he’s been stressing that he needs to tell me something. For the time being I have decided to simply ignore his message, and work through any emerging feelings with my therapist. Thanks

Update: Hi, so as I mentioned previously I decided to not respond to his message. A day after I received another message from him, which I won’t write out in its entirety, to sum it up he apologised for how disingenuous his previous message was and explained why he had reached out to me. Essentially he wanted to discuss that week, that final week before our wedding and why he left without discussing it. I’ll be honest I’m gonna refrain from going into detail about our whole stories here, but I will say my ex-fiancé (thank you for the correction btw) has been diagnosed with Avoidance PTSD from past experiences, I feel for him but I told him that I still couldn’t move past being left in a state of limbo for 3 months. Irregardless, ultimately I agreed to meet him, and I don’t regret it. He’s not with his ex, I’ve found she’s actually since passed away, which is part of the reason that she reached out to me, and yes the child is his. The lunch was short and in the end he handled me an envelope, which contained all of the money we spent preparing for the wedding. It all honesty it was cathartic for me, I’ve often feared that I’m still subconsciously harbouring feelings for him, but the lunch proved I didn’t. I’ve closed that chapter of my life, with him, with the woman I was and now, now I’m free. Thank you all"
1jcwejp,How do I tell my husband that his mom is destroying my mental health?,"I’ll try to keep this as short as possible. 
My husband (55M) and I (48F) have been together for 8 years. His mother has lived with him for 15 years (after her husband/his dad passed away). She is 82 and of sound mind. She’s never worked, never driven. 

About 2 years ago I resigned from my corporate job so that I could care for my aging parents. They both passed away about a year ago. I now work part time from home. 

My mental health took a turn for the worse when I left my job and got worse when my parents passed. I’ve worked incredibly hard to feel better (lots of therapy, antidepressants, self care, etc.). 

I’ve now realized that being home with my MIL contributes significantly to my “bad days”. While she’s always lived with us since I’ve been around, working 12 hour days previously made it easier to deal with her. 

From the time I wake up in the morning, she’s up my ass. “What are you doing today? Why are you leaving the house? When will you be home? Does (husband) know you’re leaving the house? What are you making for dinner? Can you make a doctors appointment for me?”
She won’t answer her own cell phone so as soon as her phone rings, she tracks me down to talk to whoever is on the other end, even if it’s just to confirm an appointment. Even if I’m in the middle of my own phone call or a meeting.

My husband and I travel frequently, however she refuses to be alone so we have to hire live-in care for her while we’re gone. 

I’m somewhat obsessed with cleanliness and it drives me crazy that she refuses to wash her hands after using the bathroom. She will only run her fingers under running water after touching raw meat, and then proceeds to touch everything else. She refuses to use the dishwasher and the dishes she washes have to be rewashed after I find them in the cabinet with food on them. 

I feel like I’m a prisoner in my own home. I can’t have a conversation with my husband without her making a comment. If I’m out of sight for more than 15 minutes, she will track me down to ask what I’m doing. She constantly makes comments on the things I do, the clothes I wear, how I clean. I have zero privacy because she randomly goes through my things. I leave sweet notes for my husband and she reads them and then tells me about it. If she sees us kiss, she makes a sexual comment that she finds hilarious. 

I’ve tried setting boundaries-don’t go in my bedroom, don’t touch my things, don’t interrupt me during X hours, but she ignores all of it. 

My husband knows that she’s difficult to deal with but I’m not sure that he knows how difficult it is for me. I’m at a loss for what to do because I can literally feel my mood take a nose dive when I interact with her.
"
co7khe,Is it ok for men to cry when their dog gets put down?,"My dog (his name is chewy) is being taken to the vet by my dad as I’m typing this post. Chewy is ten years old and he watched me grow up since I was 4. He was a great dog. Every time I came home from a baseball game he would sit right in front of my bed while I changed out of my uniform and got ready for the shower. He would wait for me by my bed to finish my shower and when I got back to my bed he’d hop up and lay right next to me while I watched tv. He would wait for me at the gate when I came home every day from school. I have two more dogs that I love just as much as chewy, and I have had a dog and a cat die before, but the dog was only ours for a couple days and then it ran away and got hit by a car when I turned 8 so I really had no idea how to feel about it. (I loved her but I was little and I didn’t understand that she was gone) Now that chewy is being put down my heart is broken. I know I should’ve went with my dad but he works and I wouldn’t have a ride home, and he didn’t want me to be there while my dog died. I can’t imagine being in a room as my dog is being put down, the look on his face unable to understand what is happening. I couldn’t imagine the mental scar that would leave me. I don’t know how to cope with it though and I dont like people seeing me crying because it makes me look vulnerable and I hate that. Please help.


EDIT: Thank you to everyone who commented and showed their support. I’m sorry for not replying to you guys but I’ve listened to and taken all your advice. I feel awful for not replying to any comments especially the ones that were well thought out and were extremely thoughtful and understanding."
wkb6x0,Boyfriend wants to try having me sit on his face. What do I do while I’m sat on his face?,Genuinely so confused. Anyone experienced in this?
yf5ui7,I just turned away a girl that didn't have a place to sleep,"I (21F) live alone, I'm in my last year of school. I was watching a movie, it is currently 1:41 am and I hear a knock on my door. I don't immediately open it because I'm freaking out (still am to be honest) because all my friends live quite far and they wouldn't come over without telling me first. I speak through the door and ask who is it. A girl's voice answers and I calm down. I politely ask her what she wants and her answer freaks me out even worse. She tells me that her roommate left the key to her house with a shop owner but the shop is closed and now, she doesn't have a place to sleep. I want to say yes but I blurt ""no, sorry"" because quite frankly, I don't feel comfortable with letting in a stranger. I have lived here for about two weeks and the only person I know is my neighbor. She tries to plead but I am adamant in my response and she says okay and walks away. I feel bad for her. My heart is still racing. Did I do the right thing in saying no?"
1l7couk,My boyfriends upset with my response to his daughter visiting,"Hey all, I just wanted to get some advice from parents in the community about my boyfriend’s daughter coming to stay for the month of July. I (24) have been dating my boyfriend (30 who we’ll call b) for about a year now. He had his daughter when he was around 17 and after she was born his girlfriend at the time moved to be closer with family (about 18 hrs away). B gets his daughter every July, and this is where I have some reservations.  B was renting a house off of an older gentleman who retired and the new house B will be renting is not ready until August. So, since mid May, B has been staying with me in my studio apartment. He casually mentioned to me today that his daughter would be staying with us in my studio for July. I responded that it felt a little inappropriate especially since his sister lives 5 min away from us (2 bedroom apt) and his mom is 30 min away (4 bedroom house). I tried to explain to him that it’s not appropriate for his 12 yr old  daughter to not only be meeting me for the first time but to also be sleeping on an air mattress in the same room as us. I’m my opinion she’s at that age where she needs her privacy and she’s old enough to understand relationships and might not feel comfortable staying so close to us especially since I am a stranger to her. I asked him what his daughter’s mom thought and he said he never told her because she would be okay with it. If that was my daughter I don’t think I would let her visit her dad knowing this information. It’s a scary world out there and I just want what’s best for his child. 

So to any mothers and fathers out there, am crazy for thinking like this or would you too have reservations if your kids were in the same situation. 

Also if there are any suggestions as to how u can better handle this situation please let me know. 


****UPDATE****

I just wanted to say thank you to everyone and the advice I have been given. B and I did end up having a conversation last night which I will get into, but there are a few key points I did want to go over before I get into it. 

*** also, sorry if I don’t hit every key point or this is all over the place. I am at work and the comments started to get crazy so this update is a little rushed. 


1.) With the renting/living together issue. B has been renting the house he was at previously for about 6 years up until it was sold and he was looking at getting a long term hotel or Airbnb until the new house was ready (There are some repairs and updates that need to be done from the previous tenants in the new house). I brought up him living with me for the short period until he gets a place since our relationship has grown into us talking about our future together. He does pay half the rent and we both agreed that if it did not work out I would renew my lease and we would continue to live in separate places and work from there. As of right now all of his stuff is in a storage unit and he just has his clothes at my place. 

2.) With B only getting his daughter for a month. B and his daughter’s mom were both wild teens that ended up in the wrong crowd. His ex moved closer to family for help and to get away from the environment she was living in. They are both very active in each other lives, they are still good friends, and they do have regular calls to plan stuff for their daughter ( I am normally with him when he’s on the phone with her and I have gotten to talk to her on a few occasions). Again, they have been living 18 hrs away from each other for 12 yrs. Although it might not be an excuse for some people, it does make it harder to visit people especially when both grew up in poverty and became parents at such a young age. B’s ex has since remarried and they have a beautiful family together which makes me extremely happy for his daughter. B does still see his daughter throughout the year, this is just when she actually gets to stay with him.

3.) For people thinking that I will be babysitting the month she’s here. B has been able to take off work about 3 out of the 4 weeks she’s visiting. The week he will be at work she will get to spend with her grandma who has taken time off work as well. So I’m not too worried about that. 

4.) For people saying I’m being selfish not wanting him to see his daughter. I’m actually very excited to meet her. Almost every time B and I are together we are planning for his daughter’s visit. Places she might want to eat at, outdoor adventures to try, passes to a theme park near us, tickets to a soccer game, movies, events in our city, and much more. I absolutely love kids and do want to be involved in her life but I want it to be respectful and with what she is comfortable with. I grew up with a single father and understand how it feels to be introduced to someone who might be involved in everything you do for the rest of your life. 

5.) With her staying with us. I would like to think that he was just overly excited about us meeting and did not think twice about it. I appreciate a lot of the people for explaining the legal issues and expressing other concerns as well. B did not grow up in a stable household and most of the time shared a room with his siblings and family members. Although it is not an excuse, I do think that’s why he did not see a problem with her staying with us in my studio. And I will say that did cause me to really reflect on his maturity level as well as how he would act in the future if we had kids. 

So for the update

Last night we both sat down and I expressed how his reaction made me feel not thinking it was appropriate for his daughter to stay in my studio. It felt as if he was trying to say I did not want to see his daughter when I was just really trying to look out for all parties involved. He admitted that after our first conversation he realized that him being excited for us to meet caused him to be inconsiderate to both parties. I am the first significant other to meet his child and he felt like that one month out of the year would not be enough since I would more than likely only see her on the weekends. I expressed to him that me seeing her only on the weekend might be best for our first time meeting but it was ultimately his daughter’s decision. He admitted after our first conversation that he called his ex and she did express that she would rather him get an Airbnb, stay with his mom, or stay with his sister. B’s already booked an Airbnb and will be staying there when his daughter visits. So that’s pretty much it, I honestly thought there was going to be a much larger issue and wanted to make sure I got as many point of views as possible before we sat down and talked again. Again, I would like to thank everyone for their input. Especially since this was a situation I have truly never had to deal with before. "
