post_id,post_text,post_description
1izle46,My Dad Left Us 15 Years Ago – Now He’s Dying and Wants Me to Take Care of Him. I Don’t Know What to Do,"When I was 10, my dad walked out on our family. No explanation, no contact—just gone. My mom worked multiple jobs to keep us afloat, and I had to grow up fast. Now, 15 years later, I get a call from an unknown number - It’s him. He says he’s sick, possibly terminal, and has no one else to turn to.

I have so much anger and resentment built up. He wasn’t there when I needed him, and now he wants me to be there for him? But at the same time, the idea of just ignoring him and letting him die alone feels... heavy. My mom says it’s my choice, but I can tell she hates the idea of me helping him. My siblings want nothing to do with him.

I don’t know if I owe him anything. I don’t even know what he’s been doing all these years. But a part of me wonders if I'd regret not doing something.

Has anyone been in a situation like this? What would you do?

**Edit/Update:**

Wow, I never expected this post to get so much attention. First off, thank you to everyone who took the time to comment—whether you shared advice, personal experiences, or just offered support. I’ve read through so many responses, and it’s given me a lot to think about.

The overwhelming response seems to be that I don’t owe him anything. Many of you pointed out that he made his choice 15 years ago, and now that life has come full circle, it’s not my responsibility to upend my life for him. A lot of you also suggested visiting him once—not out of obligation, but for my own closure, so that I can walk away knowing I did what I needed to do, on my terms. That really resonated with me.

Right now, I’m leaning towards seeing him once, just to hear what he has to say—not for his sake, but for mine. I want the chance to ask him questions only he can answer. I know there’s a chance his answers won’t bring me peace or could even make me angrier, but at least I’ll know I faced it.

One thing I’m certain of is I won’t be uprooting my life to take care of him. That’s a weight I refuse to carry. My time, my love, my energy—they belong to my mom and siblings. The people who stood by me. Who prioritized me. Every. Single. Time. Not just when they needed something.

I’ll update again after my visit.

Truly, thank you all. Your words made a difference.

**Edit/Update 2:**

The dreaded meeting is happening tomorrow. I’m not sure what it will reveal, but I’m doing it for myself. I’m nervous about the wounds it may reopen, but deep down, I know I’d regret not asking him the questions I’ve always had — questions only he can answer. My mum has been supportive, telling me to do what’s best for me, while my siblings want nothing to do with him and think I should stay away. Regardless, I’m taking this opportunity to face it head-on. Wish me the best, and I’ll update soon."
1j6z84l,Girlfriend just punched me in the face multiple times,"So my longtime girlfriend just had an absolute meltdown after we left dinner from her parent’s house tonight. It all started because her dad and I were watching old family videos and joking about how her and her sisters were dressed and just really light stuff about how big her great grandpa’s nose was( her Dad pointed it out and was like ”dude had a schnoz on him” and I laughed. That’s all. I swear to all things holy. 

 Fast forward to me driving home tonight and she turns off the music on the radio that I had turned on and starts trashing me about my family and how it’s strange and creepy that I actually get along with my Mom, Dad and sister. And have a drama free relationship with them, and she can’t stand it. 

So anyway I’m reading my Kindle in the living room of my house and she goes off again, about some petty bullshit that I somehow did and I’m reading a book 📖.  
  So I did what anyone else would do and just shut up and let her vent and get it out without giving her any ammunition to feed on….WRONG F*ing Move. I took my eyes off her for a second to continue my read on the couch. And she gave me a three-piece so fast that it caught me off guard, I jumped up so she wasn’t not on top of me,  she proceeded to slap the taste out of my mouth. 
  then she blocks the front door and scream for me to get away from her while blocking the only exit to leave 

I’m in my boxers  and I’m trying to grab my phone off the floor that went flying across the living room. And all I can hear is her yelling with the door open trying to have the whole neighborhood hear this shit.  

Anyway. I’m now sitting in my car with just boxers  on with a bloody lip and I thought I asked the internet for advice and by internet I mean Reddit. 


"
1hq4eut,My GF is in a medically induced coma and I am scared she is going to die.,"
My (34M) girlfriend (35F) started having chills and a runny nose on Christmas It got worse to eventually she could not breathe due to fluid filling up her lungs. She has asthma already so it even worse from there till ambulance came and took her to the ICU where they had to put her on ventilator at max oxygen and said she has influenza A . They then put her to sleep. I am scared of losing her she is the love of my life and I don’t think I can handle if anything happened to her. Can someone please give me some reassurance she’s going to be ok.  I saw her laying there with tube sticking out of her jugular and they said they had to paralyze her. They told me it will probably be a week before she’s can be awake and that it will get worse before it gets better. They said as long as her oxygen stays above 90 she will be ok. Last I looked she was at 98. I’m just trying to stay positive but I’m feeling powerless and alone… I just want to hear her voice again


Edit : Thank you all so much you touched my heart and gave me hope. I will be sure to give everyone an update as soon as I can. I will let Hannah know you all are rooting for her. She’s had a rough year like many others and was really down and I just her to know she’s not alone in this world.  You all have shown me overwhelming kindness sorry if I could not reply to all your messages but I see them and they mean the world to me

Update : they have reduced the ventilator strength to down to 60 from 100 they told me things seem to moving in a good direction. Her mother has flown in to see her. Im held Hannah’s hand told her she was loved and she was going to be ok and I saw tear roll down her eye.  

Update 2 : They said if things continue going well tonight tomorrow they will slowly take away the paralyzation over next couple of days. Her oxygen is going from 92-95. Ventilator is now down to 55. Spent the day reading your messages to her and messages from her friends and family. We played her favourite music.

Update 3: today they took her off the paralytic and said she is reacting well to that. The ventilator is now down to 40 and just now to 35. One worrisome thing they noticed is her face is really red but it may be related to her body temperature also her oxygen is at 91 right now. There’s been good news everyday so far. I remain hopeful and appreciate all the messages and comment: people have sent. I did not expect so many strangers be so honest and open. Thank you all I will continue to send updates. Happy new years to everyone 

Update 4: today they took Hannah off more of the sedation (midaz) Just now when the nurse called Hannah’s name and her eyes opened but closed again after. Such a good feeling to see her being able to respond on her own. Her blood sugar and pressure is high but they expect it to be because of the steroids she still on. Hannah is also initiating her own breaths without the help of the ventilator! They say depending how it goes overnight they will starting to take more off. Making huge progress everyday.  

Update 5: today they took Hannah off the fentanyl. She is opening her eyes and moving her whole body on her own but is not responding to direction yet.  They said she has viral and bacterial pneumonia caused by the influenza and she may have a staph infection. She has renal kidney failure. her PEEP number is still 16 . She had an adverse reaction to the suctioning of her lungs they had to bring up the ventilator to 60 but brought it back down to 35 once her vitals went back to normal . They say she still has a big fight ahead of her.  Seeing her thrash around was hard but holding her hand and talking to her seemed to calm her down

Update 6: they are moving Hannah to a different hospital because they need room for sicker patients.  The icu was starting to put two patients per room. Lots of people getting sick this holiday. Today they put her back on fentanyl for the move. They just let her rest of the day. Her vitals are doing better. They say she still has viral and bacterial pneumonia. But they may take the breathing tube out on Monday since she is breathing on her own and the ventilator is at 35.

Update 7: today Hannah’s PEEP went down to 10 from 16. She is now responding to questions and nodded her head that she could see me when I was holding her hand an. The doctor said tomorrow they will excavate the ventilator tomorrow morning and I will be able to talk to her again which is the best news I’ve heard all week.

Update 8: the doctors were unable to remove the tube because her throat is too swollen they are putting more drugs to bring it down. She is more concious and thrashing a lot more. It is hard to watch as the thrashing is making her throat more swollen and I can do anything to calm her down. Should know more tomorrow no timeline for removal.

Update 9: the doctors said the area around the tube is still swollen to remove. They are weening her off the Propofol. The delirium is making it dangerous to remove as well. Hopefully she will get a good rest I put a pillow beside her head to keep her from thrashing. I will slow down on updates until she gets the tube out. Thanks for all checking on me still.

Update 10 : day 11 they finally took the tube out. But turns out 4 of sedatives had a side effect of uncontrollable movement and forces your tongue to come out of your mouth called Dyskinesia  which is the most fucked up thing I’ve ever seen. so they need to administer her Benadryl to fight the side effects. Hannah is answering questions but is having a tough time with these new side effects she will need to remain in the ICU. Please keep Hannah in your thoughts it’s seems like she’s fighting like 5 different battles. I’m having a hard time keeping it together in the room and feel I am just upsetting her more by crying underneath my mask up.

Update 10 : day 11 they finally took the tube out. But turns out 4 of sedatives had a side effect of uncontrollable movement and forces your tongue to come out of your mouth called Dyskinesia  which is the most fucked up thing I’ve ever seen. so they need to administer her Benadryl to fight the side effects. Hannah is answering questions but is having a tough time with these new side effects she will need to remain in the ICU. Please keep Hannah in your thoughts it’s seems like she’s fighting like 5 different battles. I’m having a hard time keeping it together in the room and feel I am just upsetting her more by crying underneath my mask up.

Update 11: day 15 Hannah got the ventilator tube out and was not showing signs of dyskensia. Today was the first day me and Hannah were able to talk back and forth and her be ok. It’s a total 180. I told her everything that happened and about how total strangers sent their thoughts and prayers she was really touched and cried. The doctor said if she passes the swallowing test she can move to the ward tomorrow. I’m so happy right now. This has been one of the best days of my life."
1jxjlxv,"Professor has been secretly docking points anytime he sees someone’s phone out. Dozens of us are now at risk of failing just because we kept our phones on our desk, and I might lose the job I have lined up for when I graduate.","My professor recently revealed that he’s been docking points any time he sees anyone with their cell phone out during the lecture–even if it's just lying on their desk and they’re not using it. He’s docked more than 20 points from me alone, and I don’t even text during lectures. I just keep my phone, face down, on my desk out of habit. It's late in the semester and I'm at risk of failing this class, having to pay thousands of dollars that I can’t afford for another semester, and lose the job I have lined up for when I graduate.

I talked to him and he just smiled and referred me to a single sentence buried in the five-page syllabus that says “cell phones should not be visible during lectures.” He’s never called attention to it, or said anything about the rule. He looked so smug, like he’d just won a court case instead of just screwing a random struggling college kid with a contrived loophole.  

So far I’ve (1) tried speaking to the professor, (2) tried submitting a complaint through my school’s grade appeal system. It was denied without explanation and there doesn’t seem to be a way to appeal, and (3) tried speaking with the department head, but he didn’t seem to care - literally just said “that’s why it’s important to read the syllabus.”  

I feel like I’m out of options and I don't know what to do."
1le1rhl,Gf gave me chlamydia,Gf of 6 months just tested positive for chlamydia. I’m getting tested now. She went on a vacation a couple weeks ago with her friend. She swears she didn’t cheat on me and that she wouldn’t. Says it possible to just get it without sex. She lying to me? How likely is it she was a dormant carrier and nothing popped up for 6 months? Please give it to me straight. Don’t even know what to think rn 
1jqss1l,There’s a little girl that’s terrorizing my apartment,"

This is a very bizarre situation I’ve never been in before. Sorry for the dramatic title but it’s becoming an actual issue now. 

For the last month, it feels like 90% of the time I go outside to my car, an 8 year old girl and her dog appear and try to interact with me. 

Sounds cute right? That’s what I thought, until I realized it wasn’t. 

The first time she came up to me, she ran from across the parking lot and said, “I think my dog likes you!” I thought it was kind of sweet - until she got a little too close for comfort, started repeating that same line over and over, and giggling very loudly, almost manically. She wouldn’t leave me alone until I physically walked away. She even followed me to the apartment door, talking nonstop. 

I brushed it off at first, thinking maybe she’s neurodivergent (no judgment - I’m ADHD and probably more). I didn’t think much of it, until it became a daily thing. 

I work from home and go outside a few times a day for breaks (yes, I smoke. working on quitting). She’s always out there with her dog. Not a parent in sight. 

I started noticing red flags when her mood began flipping between happiness and sudden anger. She hits her dog a lot.  She’ll scream “Quiet! Quiet! Quiet!” and punch her dog with each word. I’ve seen her drag the dog while it’s pooping so it has to walk while going, and the dog cries. It’s awful to witness. 

She runs up to anyone outside, delivery drivers, residents, other dog owners, and repeats “I think my dog likes you!!” over and over until they respond. 

If someone has a dog, she’ll walk up to them too closely while their dogs are barking aggressively. I’ve seen multiple residents literally pick up their pets and speed walk  away from her. 

People have started cracking the exit door and scanning for her before they step outside. 

There’s construction happening next door, and she just.. hangs out with the workers. They ignore her now, but she’ll bring them offerings of handfuls of grass or her dog. It’s honestly surreal. 

When I’m outside and have to smoke, I now drive to a spot off the property just to get personal space. If I stay near my car, she’ll follow me and stand right in front of it, waving at me in a pageant-style, fingers pressed together, wave. I don’t even make eye contact.  She’ll do it for like 30 seconds, just smiling. 

If I drive into the parking lot, she sometimes chases my car to where I park.

Last week I was sitting in my car listening to music and didn’t notice her. When I looked up, she jumped up from a crouch, face pressed to my driver’s side window. I felt like I had a heart attack but also pretended not to see her because wtf lmao. 

She’s out at all hours. Last night it was 9pm and dark, she was alone with the dog. Today, it was 12:30pm on a Thursday. Shouldn’t she be in school? 

I don’t know what’s going on. I’ve never dealt with something like this before. It’s gone from weird to uncomfortable to genuinely worrying.

It feels unsafe for the dog, and definitely even for her.  I’m worried she could walk up to a weirdo and something bad could happen, or she could cause a dog fight and her and the dogs could get seriously injured.  Is there someone I should call? How do I report this kind of situation without escalating it unnecessarily? I don’t want to overstep, but this just feels wrong."
1k61aku,Is it a red flag if my gf hides their phone around me?,"Me (27m) and my girlfriend (25f) been together for about 10 months. Lately I’ve started noticing she’s really weird about her phone. Keeps it face down all the time, turns off notifications when I’m around, and takes it with her even if she’s just stepping out for a minute.

She used to be more open, like showing me memes or stuff from her chats, but now it’s like the phone is some top secret device. I’m not the kind of guy who snoops, and I haven’t gone through it, but I can’t lie – it’s starting to bother me.

I asked her if something’s up, she just said ""I like my privacy"". That’s all. No explanation.

Is this a red flag? I wanna trust her, but it’s hard not to feel like she’s hiding something. Anyone been through this?"
1h00nmp,My husband won’t wash his hands after using the bathroom at home. ,"Well the title says it all. I’ve put up with a lot of my husband’s “little quirks” but it all came to a head yesterday when my husband dipped his finger into my freshly cooked mashed potatoes after going #2. 
This would not have been a problem if my husband would just wash his meat beaters after going to the bathroom.

My husband seems to think he only has to wash his hands if he uses a public restroom. 🤢 He is trying to gaslight me into believing this is completely normal and that I’m the crazy one for washing at home. 

Please give me some advice on how to approach this with him in a constructive way. This isn’t normal right? We all wash our hands at home too right? 

Ps. I did not get to enjoy my beautiful mashed potatoes and I’ve been in a sour mood ever since. "
1k3y33x,How to tell my friend I think her 8 year old son is dangerous?,"Occasionally, I let my 6 y.o. daughter play with my friend’s 9 y.o. son and I’ve started to notice some concerning behaviour on his part. There were three things in particular that I witnessed while they playing on separate occasions recently. 

The first was when they were playing in my daughter’s above ground foldable pool. He was trying to convince my daughter to play a game where they took turns holding each other’s head under the water. “A drowning game” in his own words. I stepped in immediately and told them both no that will not be happening. His own grandmother was there at the time to witness this instance and she gave him a very half hearted reprimand which I found baffling. It set off alarm bells in my head instantly but I eventually let it go under the premise of children simply doing stupid things because I remembered that games like the “Pass out challenge” were a thing when I was a kid. 

The second instance I was not around to witness but I saw the aftermath. My daughter asked if she could go over by my friend’s house to play with her son. I asked my friend and she agreed so I carried my daughter over. My daughter brought one of her dolls with her (a cabbage patch kid). I didn’t stay over with them because this wasn’t the first time our children have had play dates by the other’s house. I trust my friend. I’ve known her for the better part of 10 years. About 2 hours later I picked up my daughter and went home. When we got inside I noticed the state of her doll and was horrified. The hair had be cut off and there was marker all over it. I wasn’t upset just shocked. It’s my daughter’s doll. She could play with it however she likes. When I inspected the doll further I saw the words ‘I Kill You’ written on the arm. I knew it wasn’t my daughter’s handwriting but I still asked her if she wrote it just in case. She told me no my friend’s son wrote it. I was concerned and wondered if to address the situation immediately but same as I am now I am unsure of where to even begin. Eventually some weeks passed and I forgot it had happened. 

The last and most recent instance happened by my house. My friend brought her son over to play while she ran some errands. While they were playing in the front yard I saw the boy hold my daughter by her clothes and do stabbing motions. I stopped the game immediately, reprimanded them both and called my friend. I lied and said I had and emergency to sort out and that she needed to pick up her son now. She came by and picked him up without issue. 

I am never letting my daughter near that boy after this under any circumstances even if it’s at the cost of my friendship. Still i’m concerned for my friend and her safety and for the safety of other children that her son plays with. This isn’t normal behaviour for an 8 y.o. I’m unsure of how to tell my friend these things. Should I do it over the phone, through text or face to face? She can be a bit of a volatile person at times. I remember a distinct instance where she pulled out a knife on her ex husband as a matter of fact. This is just a very delicate situation and I need some help on how to go about it because I truly think that boy is mentally disturbed and dangerous and needs help. 

EDIT: I didn’t think this post would blow up so fast but thank you for the advice. I feel a lot more confident in how I should go about this. For those of you that shared your experiences thank you. There are also some things I’d like to address. 

- I made an error. The child is 9 not 8. He turned 9 recently. Sorry for that slip up. 

- For people casting judgement on me for letting my child play with another child 3 years older than her. They’ve been playmates for the past 2 years without issue. These events are very recent as of the past 3 months or so. My daughter is not scared of him and actually asks to play with him or visit him often. In all the instances I described in the post she didn’t appear to be scared and she didn’t tell me she was scared. 

- Pertaining to what I will be doing moving forward: I will be calling my friend over the phone to break this tough conversation in a bit and gauge her reaction before I even think of having this discussion face to face. I’ve decided after reading through as many comments as I could I will explain to her as gently as possible that her son is exhibiting some concerning behaviour. I will tell her what I’ve seen and heard. I will tell her that I think he might be in need of some kind of counseling and I will do all of that without placing any blame. I want avoid offending her because I genuinely want her to listen and not get pissed at me for insinuating she’s a bad mother or something. I want that boy to get genuine help. 

- I’m unsure of if I want to involve CPU (that’s what it is in my country) as I’m really unaware of their procedures. I need to look into it more and I will. I also cannot involve his school or teachers because most schools in my country are unisex so they aren’t in the same school. I can’t waltz in to warn teachers about a child who is not my own especially if I myself have no child in that school. 

- Another thing, I read some comments saying this post is fake due to the post history on this account. This isn’t my account. There’s your simple answer. It’s a throwaway account of a friend. I just didn’t want to make my own. Believe me or not it’s up to you. It doesn’t really change what I’m here for. 

EDIT 2 
- Forgot to address this. When I described my friend as volatile I meant it in way that I think if I address this the wrong way she can react very badly. She does have a history of reacting badly to situations that’s what I was trying to point out with ex husband bit. Worst yet if it involves her son. 

- This woman has been there for me through some very hard times in my life. She’s been my number one supporter since my daughter was born and my ex husband left us. She visited me at the hospital when I gave birth. She helped me through my postpartum depression. We have a very rich friendship. She always helped me. So consider that before judging me for trusting her with my daughter. If I have to cut her off I would be doing so with a very heavy heart but I will do whatever is best for my daughter. "
